{"version":1,"name":"RX-78-2 ガンダム・ヘッド","objects":[{"id":"P13","name":"目 右","vertices":[[7,67,21],[20,69,21],[24,75,21],[5,72,21],[7,67,18],[20,69,18],[24,75,18],[5,72,18]],"faces":[[0,1,2,3],[7,6,5,4],[1,0,4,5],[2,1,5,6],[3,2,6,7],[0,3,7,4]],"position":[0,0,0],"rotation":[0,0,0],"scale":[1,1,1],"visible":true},{"id":"P14","name":"目 左","vertices":[[-7,67,21],[-20,69,21],[-24,75,21],[-5,72,21],[-7,67,18],[-20,69,18],[-24,75,18],[-5,72,18]],"faces":[[3,2,1,0],[4,5,6,7],[5,4,0,1],[6,5,1,2],[7,6,2,3],[4,7,3,0]],"position":[0,0,0],"rotation":[0,0,0],"scale":[1,1,1],"visible":true},{"id":"P01","name":"P01 ヘルメット","vertices":[[-32,25,18],[32,25,18],[43,44,18],[43,80,18],[27,103,18],[-27,103,18],[-43,80,18],[-43,44,18],[-27.52,30.46,-28],[27.52,30.46,-28],[36.98,46.8,-28],[36.98,77.76,-28],[23.22,97.53999999999999,-28],[-23.22,97.53999999999999,-28],[-36.98,77.76,-28],[-36.98,46.8,-28]],"faces":[[0,1,2,3,4,5,6,7],[15,14,13,12,11,10,9,8],[1,0,8,9],[2,1,9,10],[3,2,10,11],[4,3,11,12],[5,4,12,13],[6,5,13,14],[7,6,14,15],[0,7,15,8]],"position":[0,0,0],"rotation":[0,0,0],"scale":[1,1,1],"visible":true},{"id":"P02","name":"P02 フェイスマスク","vertices":[[-17,36,35],[17,36,35],[27,59,35],[14,66,35],[-14,66,35],[-27,59,35],[-17,36,18],[17,36,18],[27,59,18],[14,66,18],[-14,66,18],[-27,59,18]],"faces":[[0,1,2,3,4,5],[11,10,9,8,7,6],[1,0,6,7],[2,1,7,8],[3,2,8,9],[4,3,9,10],[5,4,10,11],[0,5,11,6]],"position":[0,0,0],"rotation":[0,0,0],"scale":[1,1,1],"visible":true},{"id":"P03","name":"P03 あご","vertices":[[-8,25,44],[8,25,44],[11,39,44],[-11,39,44],[-8,25,35],[8,25,35],[11,39,35],[-11,39,35]],"faces":[[0,1,2,3],[7,6,5,4],[1,0,4,5],[2,1,5,6],[3,2,6,7],[0,3,7,4]],"position":[0,0,0],"rotation":[0,0,0],"scale":[1,1,1],"visible":true},{"id":"P04","name":"P04 センサー","vertices":[[-9,88,27],[9,88,27],[8,110,27],[-8,110,27],[-9,88,18],[9,88,18],[8,110,18],[-8,110,18]],"faces":[[0,1,2,3],[7,6,5,4],[1,0,4,5],[2,1,5,6],[3,2,6,7],[0,3,7,4]],"position":[0,0,0],"rotation":[0,0,0],"scale":[1,1,1],"visible":true},{"id":"P05","name":"P05 Vアンテナ 右","vertices":[[7,84,27],[16,85,27],[65,126,27],[46,118,27],[7,84,18],[16,85,18],[65,126,18],[46,118,18]],"faces":[[0,1,2,3],[7,6,5,4],[1,0,4,5],[2,1,5,6],[3,2,6,7],[0,3,7,4]],"position":[0,0,0],"rotation":[0,0,0],"scale":[1,1,1],"visible":true},{"id":"P06","name":"P06 Vアンテナ 左","vertices":[[-7,84,27],[-16,85,27],[-65,126,27],[-46,118,27],[-7,84,18],[-16,85,18],[-65,126,18],[-46,118,18]],"faces":[[3,2,1,0],[4,5,6,7],[5,4,0,1],[6,5,1,2],[7,6,2,3],[4,7,3,0]],"position":[0,0,0],"rotation":[0,0,0],"scale":[1,1,1],"visible":true},{"id":"P07","name":"P07 額の装甲","vertices":[[-7,80,35],[7,80,35],[9,93,35],[-9,93,35],[-7,80,27],[7,80,27],[9,93,27],[-9,93,27]],"faces":[[0,1,2,3],[7,6,5,4],[1,0,4,5],[2,1,5,6],[3,2,6,7],[0,3,7,4]],"position":[0,0,0],"rotation":[0,0,0],"scale":[1,1,1],"visible":true},{"id":"P08","name":"P08 頬の装甲 右","vertices":[[24,34,29],[37,30,29],[47,43,29],[42,66,29],[32,64,29],[24,34,18],[37,30,18],[47,43,18],[42,66,18],[32,64,18]],"faces":[[0,1,2,3,4],[9,8,7,6,5],[1,0,5,6],[2,1,6,7],[3,2,7,8],[4,3,8,9],[0,4,9,5]],"position":[0,0,0],"rotation":[0,0,0],"scale":[1,1,1],"visible":true},{"id":"P09","name":"P09 頬の装甲 左","vertices":[[-24,34,29],[-37,30,29],[-47,43,29],[-42,66,29],[-32,64,29],[-24,34,18],[-37,30,18],[-47,43,18],[-42,66,18],[-32,64,18]],"faces":[[4,3,2,1,0],[5,6,7,8,9],[6,5,0,1],[7,6,1,2],[8,7,2,3],[9,8,3,4],[5,9,4,0]],"position":[0,0,0],"rotation":[0,0,0],"scale":[1,1,1],"visible":true},{"id":"P10","name":"P10 耳の装甲 右","vertices":[[42,52,10],[54,52,10],[54,77,10],[42,77,10],[39.12086956521739,52,-12],[51.12086956521739,52,-12],[51.12086956521739,77,-12],[39.12086956521739,77,-12]],"faces":[[0,1,2,3],[7,6,5,4],[1,0,4,5],[2,1,5,6],[3,2,6,7],[0,3,7,4]],"position":[0,0,0],"rotation":[0,0,0],"scale":[1,1,1],"visible":true},{"id":"P11","name":"P11 耳の装甲 左","vertices":[[-42,52,10],[-54,52,10],[-54,77,10],[-42,77,10],[-39.12086956521739,52,-12],[-51.12086956521739,52,-12],[-51.12086956521739,77,-12],[-39.12086956521739,77,-12]],"faces":[[3,2,1,0],[4,5,6,7],[5,4,0,1],[6,5,1,2],[7,6,2,3],[4,7,3,0]],"position":[0,0,0],"rotation":[0,0,0],"scale":[1,1,1],"visible":true},{"id":"P12","name":"P12 台座・首","vertices":[[-19,0,10],[19,0,10],[19,25.949565217391303,10],[-19,25.949565217391303,10],[-19,0,-15],[19,0,-15],[19,28.91695652173913,-15],[-19,28.91695652173913,-15]],"faces":[[0,1,2,3],[7,6,5,4],[1,0,4,5],[2,1,5,6],[3,2,6,7],[0,3,7,4]],"position":[0,0,0],"rotation":[0,0,0],"scale":[1,1,1],"visible":true}],"seams":["P01:11-12","P05:2-3","P06:2-3"],"settings":{"paper":"A4","landscape":false,"scale":100,"margin":10,"microEdgeLength":1}}